{
  "$schema": "http://json-schema.org/draft-07/schema#",
  "type": "object",
  "title": "AI Tool Schema",
  "description": "Schema for AI tool entries in the database",
  "properties": {
    "id": {
      "type": "string",
      "pattern": "^[a-z0-9-]+$",
      "description": "Unique identifier for the tool (lowercase, kebab-case)"
    },
    "name": {
      "type": "string",
      "minLength": 1,
      "maxLength": 100,
      "description": "Display name of the AI tool"
    },
    "description": {
      "type": "string",
      "minLength": 10,
      "maxLength": 500,
      "description": "Detailed description of what the tool does"
    },
    "category": {
      "type": "string",
      "enum": [
        "development",
        "design",
        "content",
        "business",
        "productivity",
        "research",
        "marketing",
        "education",
        "audio",
        "video",
        "data-science",
        "automation"
      ],
      "description": "Primary category for the tool"
    },
    "pricing": {
      "type": "string",
      "enum": ["Free", "Freemium", "Paid", "Subscription"],
      "description": "Pricing model of the tool"
    },
    "link": {
      "type": "string",
      "pattern": "^https?://.+",
      "description": "Official website or landing page URL"
    },
    "tags": {
      "type": "array",
      "items": {
        "type": "string",
        "maxLength": 30
      },
      "maxItems": 10,
      "description": "Relevant tags for search and filtering"
    },
    "featured": {
      "type": "boolean",
      "default": false,
      "description": "Whether this tool should be featured prominently"
    },
    "popular": {
      "type": "boolean",
      "default": false,
      "description": "Whether this tool is currently popular/trending"
    },
    "new": {
      "type": "boolean",
      "default": false,
      "description": "Whether this is a newly added tool"
    },
    "rating": {
      "type": "number",
      "minimum": 0,
      "maximum": 5,
      "description": "Average user rating (0-5)"
    },
    "submittedBy": {
      "type": "string",
      "description": "GitHub username of the contributor"
    },
    "submittedAt": {
      "type": "string",
      "pattern": "^\\d{4}-\\d{2}-\\d{2}T\\d{2}:\\d{2}:\\d{2}Z$",
      "description": "ISO 8601 timestamp of submission"
    },
    "lastUpdated": {
      "type": "string",
      "pattern": "^\\d{4}-\\d{2}-\\d{2}T\\d{2}:\\d{2}:\\d{2}Z$",
      "description": "ISO 8601 timestamp of last update"
    },
    "verificationStatus": {
      "type": "string",
      "enum": ["pending", "verified", "rejected"],
      "default": "pending",
      "description": "Verification status of the tool entry"
    }
  },
  "required": [
    "id",
    "name",
    "description",
    "category",
    "pricing",
    "link"
  ],
  "additionalProperties": false
}